{
  "schema_version": "1.0.0",
  "source_map_version": "1.0.0",
  "tenant_id": "tenant-demo-01",
  "generated_at": "2026-10-02T08:00:00Z",
  "mode": "live",
  "as_of": "2026-10-02T08:00:00Z",
  "sources": [
    {
      "source_kind": "omes_server_inventory",
      "authority": "omes",
      "status": "available",
      "observed_at": "2026-10-02T07:55:00Z"
    }
  ],
  "nodes": [
    {
      "node_id": "n1",
      "kind": "server",
      "source_id": "srv-xss-test",
      "label": "<img src=x onerror=alert(1)>",
      "source_state": "online",
      "visual_state": "ok",
      "freshness": "live",
      "observed_at": "2026-10-02T07:55:00Z",
      "detail_route": "/admin/omes/servers"
    }
  ],
  "relations": [],
  "truncated": {
    "nodes": 0,
    "relations": 0
  }
}
